{
    "$schema": "http://json-schema.org/draft-07/schema#",
    "type": "object",
    "properties": {
      "gpu_build": {
        "type": "object",
        "properties": {
          "value": {
            "type": "boolean"
          },
          "build_flag": {
            "type": ["string", "null"]
          }
        },
        "required": ["value", "build_flag"]
      },
      "gpu_backends": {
        "type": "object",
        "additionalProperties": {
          "type": "object",
          "properties": {
            "used_as_default": {
              "type": "boolean"
            },
            "build_flag": {
              "type": ["string", "null"]
            }, 
            "minimum_version": {
              "type": ["string", "null"]
            }
          },
          "required": ["used_as_default", "build_flag", "minimum_version"]
        }
      },
      "parallel_programming_libraries": {
        "type": "object",
        "additionalProperties": {
          "type": "object",
          "properties": {
            "used_as_default": {
              "type": "boolean"
            },
            "build_flag": {
              "type": ["string", "null"]
            }, 
            "minimum_version": {
              "type": ["string", "null"]
            }
          },
          "required": ["used_as_default", "build_flag", "minimum_version"]
        }
      },
      "linear_algebra_libraries": {
        "type": "object",
        "additionalProperties": {
          "type": "object",
          "properties": {
            "used_as_default": {
              "type": "boolean"
            },
            "build_flag": {
              "type": ["string", "null"]
            }, 
            "condition": {
              "type": ["string", "null"]
            }
          },
          "required": ["used_as_default", "build_flag", "condition"]
        }
      },
      "FFT_libraries": {
        "type": "object",
        "additionalProperties": {
          "type": "object",
          "properties": {
            "built-in": {
              "type": "boolean"
            },
            "used_as_default": {
              "type": "boolean"
            },
            "dependencies": {
              "type": ["string", "null"]
            },
            "build_flag": {
              "type": ["string", "null"]
            }
          },
          "required": ["used_as_default", "condition", "build_flag"]
        }
      },
      "other_external_libraries": {
        "type": "object",
        "additionalProperties": {
          "type": "object",
          "properties": {
            "version": {
              "type": "string"
            },
            "used_as_default": {
              "type": "boolean"
            },
            "conditions": {
              "type": "string"
            },
            "build_flag": {
              "type": ["string", "null"]
            }
          },
          "required": ["version", "used_as_default", "conditions", "build_flag"]
        }
      },
      "compiler_flags": {
        "type": "array",
        "items": {
          "type": "string"
        }
      },
      "optimization_build_flags": {
        "type": "array",
        "items": {
          "type": "string"
        }
      },
      "compilers": {
        "type": "object",
        "additionalProperties": {
          "type": "object",
          "properties": {
            "minimum_version": {
              "type": "string"
            }
          },
          "required": ["minimum_version"]
        }
      },
      "architectures": {
        "type": "array",
        "items": {
          "type": "string"
        }
      },
      "simd_vectorization": {
        "type": "object",
        "additionalProperties": {
          "type": "object",
          "properties": {
            "build_flag": {
              "type": ["string", "null"]
            },
            "default": {
              "type": "boolean"
            }
          },
          "required": ["build_flag", "default"]
        }
      }, 
        "build_system": {
          "type": "object",
          "properties": {
            "type": {
              "type": "string",
              "enum": ["cmake", "make", "undetermined"]
            },
            "minimum_version": {
              "type": "string"
            }
          },
          "required": ["type", "minimum_version"]
        }, 
        "internal_build": {
        "type": "object",
        "properties": {
          "library_name": {
            "type": "string"
          },
          "build_flag": {
            "type": ["string", "null"]
          }
        },
        "required": ["library_name", "build_flag"]
    }
    },
    "required": [
      "gpu_build",
      "gpu_backends",
      "parallel_programming_libraries",
      "linear_algebra_libraries",
      "FFT_libraries",
      "other_external_libraries",
      "compiler_flags",
      "optimization_build_flags",
      "compilers",
      "architectures",
      "simd_vectorization", 
       "build_system",
       "internal_build"
    ],
    "additionalProperties": false
  }
  