{
  "gpu_build": {
    "value": true,
    "build_flag": null
  },
  "gpu_backends": {
    "CUDA": {
      "used_as_default": false,
      "build_flag": "GGML_CUDA",
      "minimum_version": null
    },
    "HIP": {
      "used_as_default": false,
      "build_flag": "GGML_HIP",
      "minimum_version": null
    },
    "Vulkan": {
      "used_as_default": false,
      "build_flag": "GGML_VULKAN",
      "minimum_version": null
    },
    "Metal": {
      "used_as_default": true,
      "build_flag": "GGML_METAL",
      "minimum_version": null
    },
    "SYCL": {
      "used_as_default": false,
      "build_flag": "GGML_SYCL",
      "minimum_version": null
    },
    "OpenCL": {
      "used_as_default": false,
      "build_flag": "GGML_OPENCL",
      "minimum_version": null
    }
  },
  "parallel_programming_libraries": {
    "OpenMP": {
      "used_as_default": true,
      "build_flag": "GGML_OPENMP",
      "minimum_version": null
    }
  },
  "linear_algebra_libraries": {
    "Accelerate": {
      "used_as_default": true,
      "build_flag": "GGML_ACCELERATE",
      "condition": "ON"
    },
    "BLAS": {
      "used_as_default": false,
      "build_flag": "GGML_BLAS",
      "condition": "OFF unless on Apple"
    }
  },
  "FFT_libraries": {},
  "other_external_libraries": {
    "libcurl": {
      "version": "",
      "used_as_default": true,
      "conditions": "Used for downloading models",
      "build_flag": "LLAMA_CURL"
    },
    "LLGuidance": {
      "version": "",
      "used_as_default": false,
      "conditions": "Structured output in common utils",
      "build_flag": "LLAMA_LLGUIDANCE"
    }
  },
  "compiler_flags": [
    "-fsanitize=thread",
    "-fsanitize=address",
    "-fsanitize=undefined"
  ],
  "optimization_build_flags": [
    "GGML_NATIVE",
    "GGML_LTO",
    "GGML_CCACHE"
  ],
  "compilers": {
    "C": {
      "minimum_version": "11"
    },
    "CXX": {
      "minimum_version": "17"
    }
  },
  "architectures": [
    "ARM",
    "PowerPC",
    "AARCH64"
  ],
  "simd_vectorization": {
    "AVX": {
      "build_flag": "GGML_AVX",
      "default": false
    },
    "AVX2": {
      "build_flag": "GGML_AVX2",
      "default": false
    },
    "AVX512": {
      "build_flag": "GGML_AVX512",
      "default": false
    }
  },
  "build_system": {
    "type": "cmake",
    "minimum_version": "3.14"
  },
  "internal_build": {
    "library_name": "ggml",
    "build_flag": "GGML_USE_SYSTEM_GGML"
  }
}