{
  "gpu_build": {
    "value": false,
    "build_flag": "-DGMX_GPU"
  },
  "gpu_backends": {
    "CUDA": {
      "used_as_default": false,
      "build_flag": "-DGMX_GPU=CUDA",
      "minimum_version": "12.1"
    },
    "OpenCL": {
      "used_as_default": false,
      "build_flag": "-DGMX_GPU=OpenCL",
      "minimum_version": null
    },
    "SYCL": {
      "used_as_default": false,
      "build_flag": "-DGMX_GPU=SYCL",
      "minimum_version": null
    },
    "HIP": {
      "used_as_default": false,
      "build_flag": "-DGMX_GPU=HIP",
      "minimum_version": "5.2"
    }
  },
  "parallel_programming_libraries": {
    "MPI": {
      "used_as_default": false,
      "build_flag": "-DGMX_MPI",
      "minimum_version": null
    },
    "Thread-MPI": {
      "used_as_default": true,
      "build_flag": "-DGMX_THREAD_MPI",
      "minimum_version": null
    },
    "OpenMP": {
      "used_as_default": true,
      "build_flag": "-DGMX_OPENMP",
      "minimum_version": null
    }
  },
  "linear_algebra_libraries": {},
  "FFT_libraries": {
    "fftw3": {
      "built-in": false,
      "used_as_default": true,
      "dependencies": null,
      "condition": "Default if GMX_INTEL_LLVM is false",
      "build_flag": "-DGMX_FFT_LIBRARY=fftw3"
    },
    "mkl": {
      "built-in": false,
      "used_as_default": false,
      "dependencies": null,
      "condition": "Default if GMX_INTEL_LLVM is true",
      "build_flag": "-DGMX_FFT_LIBRARY=mkl"
    },
    "fftpack[built-in]": {
      "built-in": true,
      "used_as_default": false,
      "dependencies": null,
      "condition": "Built-in alternative if FFTW3 not used",
      "build_flag": "-DGMX_FFT_LIBRARY=fftpack[built-in]"
    },
    "cuFFT": {
      "built-in": false,
      "used_as_default": false,
      "dependencies": "Requires CUDA GPU backend",
      "condition": "Default if GMX_GPU==CUDA",
      "build_flag": "-DGMX_GPU_FFT_LIBRARY=cuFFT"
    },
    "clFFT": {
      "built-in": false,
      "used_as_default": false,
      "dependencies": "Requires OpenCL GPU backend",
      "condition": "Default if GMX_GPU==OpenCL on non-Apple/MSVC",
      "build_flag": "-DGMX_GPU_FFT_LIBRARY=clFFT"
    },
    "VkFFT": {
      "built-in": false,
      "used_as_default": false,
      "dependencies": "Requires HIP or OpenCL (on Apple/MSVC) or SYCL with ACPP",
      "condition": "Default if GMX_GPU==HIP or (GMX_GPU==SYCL with ACPP)",
      "build_flag": "-DGMX_GPU_FFT_LIBRARY=VkFFT"
    },
    "MKL": {
      "built-in": false,
      "used_as_default": false,
      "dependencies": "Requires SYCL with DPC++ backend",
      "condition": "Default if GMX_GPU==SYCL with non-ACPP",
      "build_flag": "-DGMX_GPU_FFT_LIBRARY=MKL"
    },
    "oneMath": {
      "built-in": false,
      "used_as_default": false,
      "dependencies": "Optional GPU FFT library",
      "condition": null,
      "build_flag": "-DGMX_GPU_FFT_LIBRARY=oneMath"
    },
    "rocFFT": {
      "built-in": false,
      "used_as_default": false,
      "dependencies": "Option for HIP builds",
      "condition": null,
      "build_flag": "-DGMX_GPU_FFT_LIBRARY=rocFFT"
    },
    "BBFFT": {
      "built-in": false,
      "used_as_default": false,
      "dependencies": "Optional GPU FFT library",
      "condition": null,
      "build_flag": "-DGMX_GPU_FFT_LIBRARY=BBFFT"
    },
    "none": {
      "built-in": false,
      "used_as_default": false,
      "dependencies": "Disables GPU FFT library",
      "condition": null,
      "build_flag": "-DGMX_GPU_FFT_LIBRARY=none"
    }
  },
  "other_external_libraries": {
    "HWLOC": {
      "version": "1.5",
      "used_as_default": false,
      "conditions": "Enabled if GMX_HWLOC is ON",
      "build_flag": null
    },
    "TinyXML2": {
      "version": "6.0.0",
      "used_as_default": false,
      "conditions": "Enabled if GMX_EXTERNAL_TINYXML2 is ON",
      "build_flag": null
    },
    "EXTRAE": {
      "version": "",
      "used_as_default": false,
      "conditions": "Enabled if GMX_EXTRAE is ON",
      "build_flag": null
    },
    "HeFFTe": {
      "version": "2.2.0",
      "used_as_default": false,
      "conditions": "Requires CUDA, HIP, or SYCL build with MPI",
      "build_flag": null
    },
    "cuFFTMp": {
      "version": "",
      "used_as_default": false,
      "conditions": "Requires CUDA build and MPI",
      "build_flag": null
    },
    "NVSHMEM": {
      "version": "",
      "used_as_default": false,
      "conditions": "Enabled if GMX_NVSHMEM is set",
      "build_flag": null
    }
  },
  "compiler_flags": [
    "-DGMX_DOUBLE=0",
    "-DNOMINMAX"
  ],
  "optimization_build_flags": [],
  "compilers": {
    "Clang": {
      "minimum_version": "14"
    },
    "GCC": {
      "minimum_version": "11"
    },
    "CUDA": {
      "minimum_version": "12.1"
    },
    "HIP": {
      "minimum_version": "5.2"
    }
  },
  "architectures": [
    "x86_64",
    "ARM"
  ],
  "simd_vectorization": {
    "AUTO": {
      "build_flag": "-DGMX_SIMD=AUTO",
      "default": true
    },
    "SSE2": {
      "build_flag": "-DGMX_SIMD=SSE2",
      "default": false
    },
    "SSE4.1": {
      "build_flag": "-DGMX_SIMD=SSE4.1",
      "default": false
    },
    "AVX_128_FMA": {
      "build_flag": "-DGMX_SIMD=AVX_128_FMA",
      "default": false
    },
    "AVX_256": {
      "build_flag": "-DGMX_SIMD=AVX_256",
      "default": false
    },
    "AVX2_256": {
      "build_flag": "-DGMX_SIMD=AVX2_256",
      "default": false
    },
    "AVX2_128": {
      "build_flag": "-DGMX_SIMD=AVX2_128",
      "default": false
    },
    "AVX_512": {
      "build_flag": "-DGMX_SIMD=AVX_512",
      "default": false
    },
    "AVX_512_KNL": {
      "build_flag": "-DGMX_SIMD=AVX_512_KNL",
      "default": false
    },
    "ARM_NEON_ASIMD": {
      "build_flag": "-DGMX_SIMD=ARM_NEON_ASIMD",
      "default": false
    },
    "ARM_SVE": {
      "build_flag": "-DGMX_SIMD=ARM_SVE",
      "default": false
    },
    "IBM_VSX": {
      "build_flag": "-DGMX_SIMD=IBM_VSX",
      "default": false
    },
    "Reference": {
      "build_flag": "-DGMX_SIMD=Reference",
      "default": false
    }
  },
  "build_system": {
    "type": "cmake",
    "minimum_version": "3.28"
  },
  "internal_build": {
    "library_name": "FFTW",
    "build_flag": "-DGMX_BUILD_OWN_FFTW"
  }
}