{
  "gpu_build": {
    "value": true,
    "build_flag": "-DGMX_GPU"
  },
  "gpu_backends": {
    "CUDA": {
      "used_as_default": false,
      "build_flag": "-DGMX_GPU=CUDA",
      "minimum_version": "12.1"
    },
    "OpenCL": {
      "used_as_default": false,
      "build_flag": "-DGMX_GPU=OpenCL",
      "minimum_version": null
    },
    "SYCL": {
      "used_as_default": false,
      "build_flag": "-DGMX_GPU=SYCL",
      "minimum_version": null
    },
    "HIP": {
      "used_as_default": false,
      "build_flag": "-DGMX_GPU=HIP",
      "minimum_version": "5.2"
    }
  },
  "parallel_programming_libraries": {
    "MPI": {
      "used_as_default": false,
      "build_flag": "-DGMX_MPI",
      "minimum_version": null
    },
    "Thread-MPI": {
      "used_as_default": true,
      "build_flag": "-DGMX_THREAD_MPI",
      "minimum_version": null
    },
    "OpenMP": {
      "used_as_default": true,
      "build_flag": "-DGMX_OPENMP",
      "minimum_version": null
    }
  },
  "linear_algebra_libraries": {
    "BLAS/LAPACK": {
      "used_as_default": true,
      "build_flag": null,
      "condition": "Automatically detected from system libraries"
    },
    "SCALAPACK": {
      "used_as_default": false,
      "build_flag": null,
      "condition": "Optional; enabled if found"
    },
    "MKL/oneMKL": {
      "used_as_default": false,
      "build_flag": null,
      "condition": "Used when GMX_INTEL_LLVM is true (FFT default becomes mkl)"
    }
  },
  "FFT_libraries": {
    "fftw3": {
      "built-in": false,
      "used_as_default": true,
      "dependencies": null,
      "build_flag": "-DGMX_FFT_LIBRARY=fftw3",
      "condition": "Default when GMX_INTEL_LLVM is false"
    },
    "mkl": {
      "built-in": false,
      "used_as_default": false,
      "dependencies": null,
      "build_flag": "-DGMX_FFT_LIBRARY=mkl",
      "condition": "Default when GMX_INTEL_LLVM is true"
    },
    "fftpack[built-in]": {
      "built-in": true,
      "used_as_default": false,
      "dependencies": null,
      "build_flag": "-DGMX_FFT_LIBRARY=fftpack[built-in]",
      "condition": "Fallback option if external FFT library not used"
    },
    "cuFFT": {
      "built-in": false,
      "used_as_default": true,
      "dependencies": "Requires GMX_GPU==CUDA",
      "build_flag": "-DGMX_GPU_FFT_LIBRARY=cuFFT",
      "condition": "Default for CUDA backend"
    },
    "clFFT": {
      "built-in": false,
      "used_as_default": true,
      "dependencies": "GMX_GPU==OPENCL on non-Apple/MSVC platforms",
      "build_flag": "-DGMX_GPU_FFT_LIBRARY=clFFT",
      "condition": "Default for OpenCL backend on supported platforms"
    },
    "VkFFT": {
      "built-in": false,
      "used_as_default": true,
      "dependencies": "GMX_GPU==HIP OR (GMX_GPU==OPENCL on Apple/MSVC) OR (GMX_GPU==SYCL with ACPP backend)",
      "build_flag": "-DGMX_GPU_FFT_LIBRARY=VkFFT",
      "condition": "Default for HIP backend and other specific SYCL/OpenCL cases"
    },
    "MKL_GPU": {
      "built-in": false,
      "used_as_default": true,
      "dependencies": "GMX_GPU==SYCL with non-ACPP backend",
      "build_flag": "-DGMX_GPU_FFT_LIBRARY=MKL",
      "condition": "Default for SYCL backend when DPCPP is supported"
    },
    "oneMath": {
      "built-in": false,
      "used_as_default": false,
      "dependencies": null,
      "build_flag": "-DGMX_GPU_FFT_LIBRARY=oneMath",
      "condition": "Alternative GPU FFT library option"
    },
    "rocFFT": {
      "built-in": false,
      "used_as_default": false,
      "dependencies": null,
      "build_flag": "-DGMX_GPU_FFT_LIBRARY=rocFFT",
      "condition": "Alternative GPU FFT library option for HIP builds"
    },
    "BBFFT": {
      "built-in": false,
      "used_as_default": false,
      "dependencies": null,
      "build_flag": "-DGMX_GPU_FFT_LIBRARY=BBFFT",
      "condition": "Experimental option"
    },
    "none": {
      "built-in": false,
      "used_as_default": false,
      "dependencies": "Explicitly disable GPU FFT support",
      "build_flag": "-DGMX_GPU_FFT_LIBRARY=none",
      "condition": "Use when no GPU FFT library is desired"
    }
  },
  "other_external_libraries": {
    "hwloc": {
      "version": "1.5",
      "used_as_default": false,
      "conditions": "Enabled with the GMX_HWLOC option",
      "build_flag": "-DGMX_HWLOC"
    },
    "TinyXML2": {
      "version": "6.0.0",
      "used_as_default": false,
      "conditions": "Enabled when GMX_EXTERNAL_TINYXML2 is ON",
      "build_flag": "-DGMX_EXTERNAL_TINYXML2"
    },
    "EXTRAE": {
      "version": "",
      "used_as_default": false,
      "conditions": "Enabled with the GMX_EXTRAE option",
      "build_flag": "-DGMX_EXTRAE"
    }
  },
  "compiler_flags": [
    "-DGMX_DOUBLE",
    "-DGMX_SIMD",
    "-DGMX_COMPILER_WARNINGS",
    "-DGMX_BUILD_SHARED_EXE"
  ],
  "optimization_build_flags": [
    "-DGMX_BUILD_FOR_COVERAGE",
    "-DGMX_CYCLE_SUBCOUNTERS"
  ],
  "compilers": {
    "Clang": {
      "minimum_version": "14"
    },
    "GCC": {
      "minimum_version": "11"
    },
    "CUDA": {
      "minimum_version": "12.1"
    },
    "HIP": {
      "minimum_version": "5.2"
    }
  },
  "architectures": [
    "AUTO",
    "None",
    "SSE2",
    "SSE4.1",
    "AVX_128_FMA",
    "AVX_256",
    "AVX2_256",
    "AVX2_128",
    "AVX_512",
    "AVX_512_KNL",
    "ARM_NEON_ASIMD",
    "ARM_SVE",
    "IBM_VSX",
    "Reference"
  ],
  "simd_vectorization": {
    "AUTO": {
      "build_flag": "-DGMX_SIMD=AUTO",
      "default": true
    },
    "None": {
      "build_flag": "-DGMX_SIMD=None",
      "default": false
    },
    "SSE2": {
      "build_flag": "-DGMX_SIMD=SSE2",
      "default": false
    },
    "SSE4.1": {
      "build_flag": "-DGMX_SIMD=SSE4.1",
      "default": false
    },
    "AVX_128_FMA": {
      "build_flag": "-DGMX_SIMD=AVX_128_FMA",
      "default": false
    },
    "AVX_256": {
      "build_flag": "-DGMX_SIMD=AVX_256",
      "default": false
    },
    "AVX2_256": {
      "build_flag": "-DGMX_SIMD=AVX2_256",
      "default": false
    },
    "AVX2_128": {
      "build_flag": "-DGMX_SIMD=AVX2_128",
      "default": false
    },
    "AVX_512": {
      "build_flag": "-DGMX_SIMD=AVX_512",
      "default": false
    },
    "AVX_512_KNL": {
      "build_flag": "-DGMX_SIMD=AVX_512_KNL",
      "default": false
    },
    "ARM_NEON_ASIMD": {
      "build_flag": "-DGMX_SIMD=ARM_NEON_ASIMD",
      "default": false
    },
    "ARM_SVE": {
      "build_flag": "-DGMX_SIMD=ARM_SVE",
      "default": false
    },
    "IBM_VSX": {
      "build_flag": "-DGMX_SIMD=IBM_VSX",
      "default": false
    },
    "Reference": {
      "build_flag": "-DGMX_SIMD=Reference",
      "default": false
    }
  },
  "build_system": {
    "type": "cmake",
    "minimum_version": "3.28"
  },
  "internal_build": {
    "library_name": "FFTW3",
    "build_flag": "-DGMX_BUILD_OWN_FFTW"
  }
}