{
  "gpu_build": {
    "value": true,
    "build_flag": null
  },
  "gpu_backends": {
    "CUDA": {
      "used_as_default": false,
      "build_flag": "-DGGML_CUDA",
      "minimum_version": null
    },
    "HIP": {
      "used_as_default": false,
      "build_flag": "-DGGML_HIP",
      "minimum_version": null
    },
    "OpenCL": {
      "used_as_default": false,
      "build_flag": "-DGGML_OPENCL",
      "minimum_version": null
    },
    "SYCL": {
      "used_as_default": false,
      "build_flag": "-DGGML_SYCL",
      "minimum_version": null
    },
    "Vulkan": {
      "used_as_default": false,
      "build_flag": "-DGGML_VULKAN",
      "minimum_version": null
    },
    "MUSA": {
      "used_as_default": false,
      "build_flag": "-DGGML_MUSA",
      "minimum_version": null
    }
  },
  "parallel_programming_libraries": {
    "OpenMP": {
      "used_as_default": true,
      "build_flag": "-DGGML_OPENMP",
      "minimum_version": null
    }
  },
  "linear_algebra_libraries": {
    "BLAS": {
      "used_as_default": false,
      "build_flag": "-DGGML_BLAS",
      "condition": "Default depends on operating system (Apple: ON, Others: OFF); vendor specified by GGML_BLAS_VENDOR"
    },
    "Accelerate": {
      "used_as_default": true,
      "build_flag": "-DGGML_ACCELERATE",
      "condition": null
    }
  },
  "FFT_libraries": {},
  "other_external_libraries": {
    "libcurl": {
      "version": "",
      "used_as_default": true,
      "conditions": "Enabled when LLAMA_BUILD_COMMON is ON",
      "build_flag": "-DLLAMA_CURL"
    },
    "LLGuidance": {
      "version": "",
      "used_as_default": false,
      "conditions": "Enabled if LLAMA_LLGUIDANCE is ON",
      "build_flag": "-DLLAMA_LLGUIDANCE"
    },
    "Kompute": {
      "version": "",
      "used_as_default": false,
      "conditions": "",
      "build_flag": "-DGGML_KOMPUTE"
    }
  },
  "compiler_flags": [
    "/utf-8",
    "/bigobj",
    "-fsanitize=thread",
    "-fsanitize=address",
    "-fsanitize=undefined"
  ],
  "optimization_build_flags": [
    "-DGGML_LTO",
    "-DGGML_CCACHE",
    "-DGGML_AVX",
    "-DGGML_AVX_VNNI",
    "-DGGML_AVX2",
    "-DGGML_BMI2",
    "-DGGML_AVX512",
    "-DGGML_AVX512_VBMI",
    "-DGGML_AVX512_VNNI",
    "-DGGML_AVX512_BF16",
    "-DGGML_FMA",
    "-DGGML_F16C",
    "-DGGML_AMX_TILE",
    "-DGGML_AMX_INT8",
    "-DGGML_AMX_BF16",
    "-DGGML_LASX",
    "-DGGML_LSX",
    "-DGGML_RVV",
    "-DGGML_RV_ZFH",
    "-DGGML_VXE",
    "-DGGML_CUDA_FA",
    "-DGGML_CUDA_FA_ALL_QUANTS",
    "-DGGML_CUDA_GRAPHS",
    "-DGGML_HIP_GRAPHS",
    "-DGGML_HIP_NO_VMM",
    "-DGGML_HIP_ROCWMMA_FATTN",
    "-DGGML_HIP_UMA"
  ],
  "compilers": {
    "MSVC": {
      "minimum_version": "undetermined"
    },
    "GCC": {
      "minimum_version": "undetermined"
    },
    "Clang": {
      "minimum_version": "undetermined"
    }
  },
  "architectures": [
    "x86",
    "ARM",
    "PowerPC",
    "RISCV"
  ],
  "simd_vectorization": {
    "AVX": {
      "build_flag": "-DGGML_AVX",
      "default": false
    },
    "AVX_VNNI": {
      "build_flag": "-DGGML_AVX_VNNI",
      "default": false
    },
    "AVX2": {
      "build_flag": "-DGGML_AVX2",
      "default": false
    },
    "BMI2": {
      "build_flag": "-DGGML_BMI2",
      "default": false
    },
    "AVX512": {
      "build_flag": "-DGGML_AVX512",
      "default": false
    },
    "AVX512_VBMI": {
      "build_flag": "-DGGML_AVX512_VBMI",
      "default": false
    },
    "AVX512_VNNI": {
      "build_flag": "-DGGML_AVX512_VNNI",
      "default": false
    },
    "AVX512_BF16": {
      "build_flag": "-DGGML_AVX512_BF16",
      "default": false
    },
    "FMA": {
      "build_flag": "-DGGML_FMA",
      "default": false
    },
    "F16C": {
      "build_flag": "-DGGML_F16C",
      "default": false
    },
    "AMX_TILE": {
      "build_flag": "-DGGML_AMX_TILE",
      "default": false
    },
    "AMX_INT8": {
      "build_flag": "-DGGML_AMX_INT8",
      "default": false
    },
    "AMX_BF16": {
      "build_flag": "-DGGML_AMX_BF16",
      "default": false
    },
    "LASX": {
      "build_flag": "-DGGML_LASX",
      "default": true
    },
    "LSX": {
      "build_flag": "-DGGML_LSX",
      "default": true
    },
    "RVV": {
      "build_flag": "-DGGML_RVV",
      "default": true
    },
    "RV_ZFH": {
      "build_flag": "-DGGML_RV_ZFH",
      "default": false
    },
    "VXE": {
      "build_flag": "-DGGML_VXE",
      "default": true
    }
  },
  "build_system": {
    "type": "cmake",
    "minimum_version": "3.14"
  },
  "internal_build": {
    "library_name": "None",
    "build_flag": null
  }
}
