{
  "gpu_build": {
    "value": true,
    "build_flag": "-DGMX_GPU"
  },
  "gpu_backends": {
    "CUDA": {
      "used_as_default": false,
      "build_flag": "-DGMX_GPU=CUDA",
      "minimum_version": "12.1"
    },
    "OpenCL": {
      "used_as_default": false,
      "build_flag": "-DGMX_GPU=OpenCL",
      "minimum_version": null
    },
    "SYCL": {
      "used_as_default": false,
      "build_flag": "-DGMX_GPU=SYCL",
      "minimum_version": null
    },
    "HIP": {
      "used_as_default": false,
      "build_flag": "-DGMX_GPU=HIP",
      "minimum_version": "5.2"
    }
  },
  "parallel_programming_libraries": {
    "MPI": {
      "used_as_default": false,
      "build_flag": "-DGMX_MPI",
      "minimum_version": null
    },
    "ThreadMPI": {
      "used_as_default": true,
      "build_flag": "-DGMX_THREAD_MPI",
      "minimum_version": null
    },
    "OpenMP": {
      "used_as_default": true,
      "build_flag": "-DGMX_OPENMP",
      "minimum_version": null
    }
  },
  "linear_algebra_libraries": {
    "MKL": {
      "used_as_default": false,
      "build_flag": "-DGMX_FFT_LIBRARY=mkl",
      "condition": "GMX_INTEL_LLVM set"
    },
    "fftw3": {
      "used_as_default": true,
      "build_flag": "-DGMX_FFT_LIBRARY=fftw3",
      "condition": "Default if GMX_INTEL_LLVM not set"
    }
  },
  "FFT_libraries": {
    "fftw3": {
      "built-in": false,
      "used_as_default": true,
      "dependencies": null,
      "build_flag": "-DGMX_FFT_LIBRARY=fftw3",
      "condition": null
    },
    "mkl": {
      "built-in": false,
      "used_as_default": false,
      "dependencies": null,
      "build_flag": "-DGMX_FFT_LIBRARY=mkl",
      "condition": null
    },
    "fftpack[built-in]": {
      "built-in": true,
      "used_as_default": false,
      "dependencies": null,
      "build_flag": "-DGMX_FFT_LIBRARY=fftpack[built-in]",
      "condition": null
    },
    "cuFFT": {
      "built-in": false,
      "used_as_default": true,
      "dependencies": "Requires CUDA",
      "build_flag": "-DGMX_GPU_FFT_LIBRARY=cuFFT",
      "condition": "GPU backend CUDA"
    },
    "clFFT": {
      "built-in": false,
      "used_as_default": false,
      "dependencies": "Used with GPU=OpenCL on non-APPLE/MSVC toolchains",
      "build_flag": "-DGMX_GPU_FFT_LIBRARY=clFFT",
      "condition": "GPU backend OpenCL"
    },
    "VkFFT": {
      "built-in": false,
      "used_as_default": true,
      "dependencies": "Used with GPU=HIP or SYCL with ACPP",
      "build_flag": "-DGMX_GPU_FFT_LIBRARY=VkFFT",
      "condition": "GPU backend HIP or SYCL with ACPP"
    },
    "MKL": {
      "built-in": false,
      "used_as_default": false,
      "dependencies": "GPU backend SYCL with DPCPP",
      "build_flag": "-DGMX_GPU_FFT_LIBRARY=MKL",
      "condition": "GPU backend SYCL with DPCPP"
    },
    "oneMath": {
      "built-in": false,
      "used_as_default": false,
      "dependencies": null,
      "build_flag": "-DGMX_GPU_FFT_LIBRARY=oneMath",
      "condition": null
    },
    "rocFFT": {
      "built-in": false,
      "used_as_default": false,
      "dependencies": "Used with GPU HIP",
      "build_flag": "-DGMX_GPU_FFT_LIBRARY=rocFFT",
      "condition": "GPU backend HIP"
    },
    "BBFFT": {
      "built-in": false,
      "used_as_default": false,
      "dependencies": null,
      "build_flag": "-DGMX_GPU_FFT_LIBRARY=BBFFT",
      "condition": null
    }
  },
  "other_external_libraries": {
    "HWLOC": {
      "version": "1.5",
      "used_as_default": false,
      "conditions": "Enabled if GMX_HWLOC option is ON",
      "build_flag": null
    },
    "TinyXML2": {
      "version": "6.0.0",
      "used_as_default": false,
      "conditions": "Enabled when GMX_EXTERNAL_TINYXML2 is ON",
      "build_flag": null
    },
    "EXTRAE": {
      "version": "",
      "used_as_default": false,
      "conditions": "Enabled when GMX_EXTRAE is ON",
      "build_flag": null
    },
    "HeFFTe": {
      "version": "2.2.0",
      "used_as_default": false,
      "conditions": "Requires GPU (CUDA/HIP/SYCL) and MPI; selected based on FFT backend",
      "build_flag": null
    },
    "cuFFTMp": {
      "version": "",
      "used_as_default": false,
      "conditions": "Requires CUDA and MPI",
      "build_flag": null
    },
    "ImageMagick": {
      "version": "",
      "used_as_default": false,
      "conditions": "Found via ImageMagick package for conversion support",
      "build_flag": null
    }
  },
  "compiler_flags": [
    "-DGMX_DOUBLE",
    "-DGMX_GPU",
    "-DGMX_SYCL",
    "-DGMX_SIMD",
    "-DGMX_OPENMP",
    "-DGMX_FFT_LIBRARY",
    "-DGMX_GPU_FFT_LIBRARY",
    "-DNOMINMAX"
  ],
  "optimization_build_flags": [
    "-DGMX_USE_RDTSCP",
    "-fprofile-arcs -ftest-coverage"
  ],
  "compilers": {
    "GCC": {
      "minimum_version": "11"
    },
    "Clang": {
      "minimum_version": "14"
    },
    "CUDA": {
      "minimum_version": "12.1"
    },
    "HIP": {
      "minimum_version": "5.2"
    }
  },
  "architectures": [
    "x86_64",
    "ARM"
  ],
  "simd_vectorization": {
    "AUTO": {
      "build_flag": "-DGMX_SIMD=AUTO",
      "default": true
    },
    "None": {
      "build_flag": "-DGMX_SIMD=None",
      "default": false
    },
    "SSE2": {
      "build_flag": "-DGMX_SIMD=SSE2",
      "default": false
    },
    "SSE4.1": {
      "build_flag": "-DGMX_SIMD=SSE4.1",
      "default": false
    },
    "AVX_128_FMA": {
      "build_flag": "-DGMX_SIMD=AVX_128_FMA",
      "default": false
    },
    "AVX_256": {
      "build_flag": "-DGMX_SIMD=AVX_256",
      "default": false
    },
    "AVX2_256": {
      "build_flag": "-DGMX_SIMD=AVX2_256",
      "default": false
    },
    "AVX2_128": {
      "build_flag": "-DGMX_SIMD=AVX2_128",
      "default": false
    },
    "AVX_512": {
      "build_flag": "-DGMX_SIMD=AVX_512",
      "default": false
    },
    "AVX_512_KNL": {
      "build_flag": "-DGMX_SIMD=AVX_512_KNL",
      "default": false
    },
    "ARM_NEON_ASIMD": {
      "build_flag": "-DGMX_SIMD=ARM_NEON_ASIMD",
      "default": false
    },
    "ARM_SVE": {
      "build_flag": "-DGMX_SIMD=ARM_SVE",
      "default": false
    },
    "IBM_VSX": {
      "build_flag": "-DGMX_SIMD=IBM_VSX",
      "default": false
    },
    "Reference": {
      "build_flag": "-DGMX_SIMD=Reference",
      "default": false
    }
  },
  "build_system": {
    "type": "cmake",
    "minimum_version": "3.28"
  },
  "internal_build": {
    "library_name": "FFTW",
    "build_flag": "-DGMX_BUILD_OWN_FFTW"
  }
}